{"schema_version":"1.0.0","case_id":"case-demo-20260927","evidence_id":"ev-demo-transactions","sha256":"0000000000000000000000000000000000000000000000000000000000000000","byte_size":0,"original_filename":"transactions.ndjson","format":"ndjson","parser_version":"fixture-generator-1.0.0","acquisition_note":"Created locally from the pinned synthetic generator seed.","licence_authority_note":"Synthetic TraceX demonstration data only.","synthetic":true}
